File Names/Locations and Preferences,,Notes
Simulation Title,Sambor_EA,Required
Input file folder path,C:\Users\twild\JWRPM\Results\Output_Storage\Scenarios_Input_Data,"Required; Be sure to adjust so convention reflects operating system in use, e.g. './Output_Storage/Scenarios_Input_Data'  in Linux"
Input file name,,"If blank, will append "" - Simulation_Title.xlsx"" to ""PySedSim_Input_File"""
Parameter ranges for Monte-Carlo,Parameters_for_MC_Stochastic.xlsx,
Simulation output file path,C:\Users\twild\JWRPM\Results\Output_Storage,"Required; Be sure to adjust so convention reflects operating system in use, e.g. './Output_Storage' in Linux to store directly in sub-folder"
